{
  "schema_version": "subject-candidate/v1",
  "candidate_id": "candidate_1ad0a6566b3666faffce625d44dde881",
  "producer": {
    "id": "github-radar",
    "version": "0.1.0"
  },
  "repository_url": "https://github.com/taipei49314/greenwash",
  "resolved_source": {
    "commit_sha": "1111111111111111111111111111111111111111",
    "tree_sha": "2222222222222222222222222222222222222222"
  },
  "observed_at": "2026-08-14T00:00:00Z",
  "source_artifact": {
    "artifact_id": "artifact_11111111111111111111111111111111",
    "digest": {
      "algorithm": "sha256",
      "value": "3333333333333333333333333333333333333333333333333333333333333333"
    }
  },
  "limitations": [
    {
      "code": "discovery_only",
      "statement": "github-radar observed these identifiers but did not admit or execute the repository."
    },
    {
      "code": "ewb_reresolution_required",
      "statement": "EWB must independently resolve the commit and tree before admission."
    }
  ],
  "trust_state": "untrusted_candidate",
  "admission_requirement": "ewb_reresolve_commit_and_tree",
  "authority_effect": "none"
}
